<?xml version="1.0" encoding="UTF-8"?>
<dataroot xmlns:od="urn:schemas-microsoft-com:officedata" xmlns:xsi="http://www.w3.org/2001/XMLSchema-instance"  xsi:noNamespaceSchemaLocation="10_Instruments.xsd" generated="2024-10-03T14:52:14">
<_x0031_0_Instruments>
<InstrumentID>1</InstrumentID>
<InstrumentName>RCADS-47-Y-EN</InstrumentName>
<InstrumentCollection>1</InstrumentCollection>
<Language>1</Language>
<Respondent>1</Respondent>
</_x0031_0_Instruments>
<_x0031_0_Instruments>
<InstrumentID>2</InstrumentID>
<InstrumentName>RCADS-47-CG-EN</InstrumentName>
<InstrumentCollection>1</InstrumentCollection>
<Language>1</Language>
<Respondent>2</Respondent>
</_x0031_0_Instruments>
<_x0031_0_Instruments>
<InstrumentID>3</InstrumentID>
<InstrumentName>RCADS-25-Y-EN</InstrumentName>
<InstrumentCollection>1</InstrumentCollection>
<Language>1</Language>
<Respondent>1</Respondent>
</_x0031_0_Instruments>
<_x0031_0_Instruments>
<InstrumentID>4</InstrumentID>
<InstrumentName>RCADS-25-CG-EN</InstrumentName>
<InstrumentCollection>1</InstrumentCollection>
<Language>1</Language>
<Respondent>2</Respondent>
</_x0031_0_Instruments>
<_x0031_0_Instruments>
<InstrumentID>5</InstrumentID>
<InstrumentName>RCADS-47-Y-DE</InstrumentName>
<InstrumentCollection>1</InstrumentCollection>
<Language>9</Language>
<Respondent>1</Respondent>
</_x0031_0_Instruments>
<_x0031_0_Instruments>
<InstrumentID>6</InstrumentID>
<InstrumentName>RCADS-47-CG-DE</InstrumentName>
<InstrumentCollection>1</InstrumentCollection>
<Language>9</Language>
<Respondent>2</Respondent>
</_x0031_0_Instruments>
<_x0031_0_Instruments>
<InstrumentID>7</InstrumentID>
<InstrumentName>RCADS-25-Y-DE</InstrumentName>
<InstrumentCollection>1</InstrumentCollection>
<Language>9</Language>
<Respondent>1</Respondent>
</_x0031_0_Instruments>
<_x0031_0_Instruments>
<InstrumentID>8</InstrumentID>
<InstrumentName>RCADS-25-CG-DE</InstrumentName>
<InstrumentCollection>1</InstrumentCollection>
<Language>9</Language>
<Respondent>2</Respondent>
</_x0031_0_Instruments>
<_x0031_0_Instruments>
<InstrumentID>9</InstrumentID>
<InstrumentName>RCADS-47-Y-DA</InstrumentName>
<InstrumentCollection>1</InstrumentCollection>
<Language>4</Language>
<Respondent>1</Respondent>
</_x0031_0_Instruments>
<_x0031_0_Instruments>
<InstrumentID>10</InstrumentID>
<InstrumentName>RCADS-47-CG-DA</InstrumentName>
<InstrumentCollection>1</InstrumentCollection>
<Language>4</Language>
<Respondent>2</Respondent>
</_x0031_0_Instruments>
<_x0031_0_Instruments>
<InstrumentID>11</InstrumentID>
<InstrumentName>RCADS-25-Y-DA</InstrumentName>
<InstrumentCollection>1</InstrumentCollection>
<Language>4</Language>
<Respondent>1</Respondent>
</_x0031_0_Instruments>
<_x0031_0_Instruments>
<InstrumentID>12</InstrumentID>
<InstrumentName>RCADS-25-CG-DA</InstrumentName>
<InstrumentCollection>1</InstrumentCollection>
<Language>4</Language>
<Respondent>2</Respondent>
</_x0031_0_Instruments>
<_x0031_0_Instruments>
<InstrumentID>13</InstrumentID>
<InstrumentName>RCADS-47-Y-FR</InstrumentName>
<InstrumentCollection>1</InstrumentCollection>
<Language>8</Language>
<Respondent>1</Respondent>
</_x0031_0_Instruments>
<_x0031_0_Instruments>
<InstrumentID>14</InstrumentID>
<InstrumentName>RCADS-47-CG-FR</InstrumentName>
<InstrumentCollection>1</InstrumentCollection>
<Language>8</Language>
<Respondent>2</Respondent>
</_x0031_0_Instruments>
<_x0031_0_Instruments>
<InstrumentID>15</InstrumentID>
<InstrumentName>RCADS-25-Y-FR</InstrumentName>
<InstrumentCollection>1</InstrumentCollection>
<Language>8</Language>
<Respondent>1</Respondent>
</_x0031_0_Instruments>
<_x0031_0_Instruments>
<InstrumentID>16</InstrumentID>
<InstrumentName>RCADS-25-CG-FR</InstrumentName>
<InstrumentCollection>1</InstrumentCollection>
<Language>8</Language>
<Respondent>2</Respondent>
</_x0031_0_Instruments>
<_x0031_0_Instruments>
<InstrumentID>17</InstrumentID>
<InstrumentName>RCADS-47-Y-ES</InstrumentName>
<InstrumentCollection>1</InstrumentCollection>
<Language>21</Language>
<Respondent>1</Respondent>
</_x0031_0_Instruments>
<_x0031_0_Instruments>
<InstrumentID>18</InstrumentID>
<InstrumentName>RCADS-47-CG-ES</InstrumentName>
<InstrumentCollection>1</InstrumentCollection>
<Language>21</Language>
<Respondent>2</Respondent>
</_x0031_0_Instruments>
<_x0031_0_Instruments>
<InstrumentID>19</InstrumentID>
<InstrumentName>RCADS-25-Y-ES</InstrumentName>
<InstrumentCollection>1</InstrumentCollection>
<Language>21</Language>
<Respondent>1</Respondent>
</_x0031_0_Instruments>
<_x0031_0_Instruments>
<InstrumentID>20</InstrumentID>
<InstrumentName>RCADS-25-CG-ES</InstrumentName>
<InstrumentCollection>1</InstrumentCollection>
<Language>21</Language>
<Respondent>2</Respondent>
</_x0031_0_Instruments>
<_x0031_0_Instruments>
<InstrumentID>21</InstrumentID>
<InstrumentName>RCADS-47-Y-AR</InstrumentName>
<InstrumentCollection>1</InstrumentCollection>
<Language>2</Language>
<Respondent>1</Respondent>
</_x0031_0_Instruments>
<_x0031_0_Instruments>
<InstrumentID>22</InstrumentID>
<InstrumentName>RCADS-47-CG-AR</InstrumentName>
<InstrumentCollection>1</InstrumentCollection>
<Language>2</Language>
<Respondent>2</Respondent>
</_x0031_0_Instruments>
<_x0031_0_Instruments>
<InstrumentID>23</InstrumentID>
<InstrumentName>RCADS-25-Y-AR</InstrumentName>
<InstrumentCollection>1</InstrumentCollection>
<Language>2</Language>
<Respondent>1</Respondent>
</_x0031_0_Instruments>
<_x0031_0_Instruments>
<InstrumentID>24</InstrumentID>
<InstrumentName>RCADS-25-CG-AR</InstrumentName>
<InstrumentCollection>1</InstrumentCollection>
<Language>2</Language>
<Respondent>2</Respondent>
</_x0031_0_Instruments>
<_x0031_0_Instruments>
<InstrumentID>25</InstrumentID>
<InstrumentName>RCADS-47-Y-CH-HANS</InstrumentName>
<InstrumentCollection>1</InstrumentCollection>
<Language>3</Language>
<Respondent>1</Respondent>
</_x0031_0_Instruments>
<_x0031_0_Instruments>
<InstrumentID>26</InstrumentID>
<InstrumentName>RCADS-47-CG-CH-HANS</InstrumentName>
<InstrumentCollection>1</InstrumentCollection>
<Language>3</Language>
<Respondent>2</Respondent>
</_x0031_0_Instruments>
<_x0031_0_Instruments>
<InstrumentID>27</InstrumentID>
<InstrumentName>RCADS-25-Y-CH-HANS</InstrumentName>
<InstrumentCollection>1</InstrumentCollection>
<Language>3</Language>
<Respondent>1</Respondent>
</_x0031_0_Instruments>
<_x0031_0_Instruments>
<InstrumentID>28</InstrumentID>
<InstrumentName>RCADS-25-CG-CH-HANS</InstrumentName>
<InstrumentCollection>1</InstrumentCollection>
<Language>3</Language>
<Respondent>2</Respondent>
</_x0031_0_Instruments>
<_x0031_0_Instruments>
<InstrumentID>29</InstrumentID>
<InstrumentName>RCADS-47-Y-NL</InstrumentName>
<InstrumentCollection>1</InstrumentCollection>
<Language>5</Language>
<Respondent>1</Respondent>
</_x0031_0_Instruments>
<_x0031_0_Instruments>
<InstrumentID>30</InstrumentID>
<InstrumentName>RCADS-47-CG-NL</InstrumentName>
<InstrumentCollection>1</InstrumentCollection>
<Language>5</Language>
<Respondent>2</Respondent>
</_x0031_0_Instruments>
<_x0031_0_Instruments>
<InstrumentID>31</InstrumentID>
<InstrumentName>RCADS-25-Y-NL</InstrumentName>
<InstrumentCollection>1</InstrumentCollection>
<Language>5</Language>
<Respondent>1</Respondent>
</_x0031_0_Instruments>
<_x0031_0_Instruments>
<InstrumentID>32</InstrumentID>
<InstrumentName>RCADS-25-CG-NL</InstrumentName>
<InstrumentCollection>1</InstrumentCollection>
<Language>5</Language>
<Respondent>2</Respondent>
</_x0031_0_Instruments>
<_x0031_0_Instruments>
<InstrumentID>33</InstrumentID>
<InstrumentName>RCADS-47-Y-ET</InstrumentName>
<InstrumentCollection>1</InstrumentCollection>
<Language>6</Language>
<Respondent>1</Respondent>
</_x0031_0_Instruments>
<_x0031_0_Instruments>
<InstrumentID>34</InstrumentID>
<InstrumentName>RCADS-47-CG-ET</InstrumentName>
<InstrumentCollection>1</InstrumentCollection>
<Language>6</Language>
<Respondent>2</Respondent>
</_x0031_0_Instruments>
<_x0031_0_Instruments>
<InstrumentID>35</InstrumentID>
<InstrumentName>RCADS-25-Y-ET</InstrumentName>
<InstrumentCollection>1</InstrumentCollection>
<Language>6</Language>
<Respondent>1</Respondent>
</_x0031_0_Instruments>
<_x0031_0_Instruments>
<InstrumentID>36</InstrumentID>
<InstrumentName>RCADS-25-CG-ET</InstrumentName>
<InstrumentCollection>1</InstrumentCollection>
<Language>6</Language>
<Respondent>2</Respondent>
</_x0031_0_Instruments>
<_x0031_0_Instruments>
<InstrumentID>37</InstrumentID>
<InstrumentName>RCADS-47-Y-FI</InstrumentName>
<InstrumentCollection>1</InstrumentCollection>
<Language>7</Language>
<Respondent>1</Respondent>
</_x0031_0_Instruments>
<_x0031_0_Instruments>
<InstrumentID>38</InstrumentID>
<InstrumentName>RCADS-47-CG-FI</InstrumentName>
<InstrumentCollection>1</InstrumentCollection>
<Language>7</Language>
<Respondent>2</Respondent>
</_x0031_0_Instruments>
<_x0031_0_Instruments>
<InstrumentID>39</InstrumentID>
<InstrumentName>RCADS-25-Y-FI</InstrumentName>
<InstrumentCollection>1</InstrumentCollection>
<Language>7</Language>
<Respondent>1</Respondent>
</_x0031_0_Instruments>
<_x0031_0_Instruments>
<InstrumentID>40</InstrumentID>
<InstrumentName>RCADS-25-CG-FI</InstrumentName>
<InstrumentCollection>1</InstrumentCollection>
<Language>7</Language>
<Respondent>2</Respondent>
</_x0031_0_Instruments>
<_x0031_0_Instruments>
<InstrumentID>41</InstrumentID>
<InstrumentName>RCADS-47-Y-EL</InstrumentName>
<InstrumentCollection>1</InstrumentCollection>
<Language>10</Language>
<Respondent>1</Respondent>
</_x0031_0_Instruments>
<_x0031_0_Instruments>
<InstrumentID>42</InstrumentID>
<InstrumentName>RCADS-47-CG-EL</InstrumentName>
<InstrumentCollection>1</InstrumentCollection>
<Language>10</Language>
<Respondent>2</Respondent>
</_x0031_0_Instruments>
<_x0031_0_Instruments>
<InstrumentID>43</InstrumentID>